자격명,관련법,소관부처,소관부처홈페이지,시행기관,시행기관홈페이지,법의 목적,자격 제도 도입 취지,자격체제(등급),당해직의 직무 내용,자격 취득 요건,응시 자격,시행 기관(상세),검정 방법,검정 과목,합격 기준,자격 취득자의 진로,시험 면제 사항
가축인공수정사,축산법,농림축산식품부,http://www.mafra.go.kr/,자치단체통합 인터넷원서접수센터,http://local.gosi.go.kr/kali/index.jsp,"가축의 개량·증식, 축산업의 구조개선, 가축과 축산물의 수급조절·가격안정 및 유통개선 등에 관한 사항을 규정하여 축산업을 발전시키고 축산농가의 소득을 증대시키며 축산물을 안정적으로 공급하는 데 이바지하는 것을 목적으로 한다.","인공수정은 우수한 품종의 종자획득, 일정량의 정액으로 다수를 수태시킬 수 있어 가축 개량이 용이하고, 자연교배보다 높은 수태율, 자연교배에 의한 각종 전염성질환 예방 등의 장점이 있음. 그러나 미숙한 가축인공수정 기술은 역효과를 초래하게 되고 질병을 급속도로 감염시킬 수 있기 때문에 전문적인 지식과 자격을 갖춘 사람으로 하여금 업무를 수행하도록 함.",단일등급,"◎ 우수한 품종의 수컷 정액을 채취하여 정액의 질병유무나 기형유무 검사, 보관, 관리하고 인공수정하는 업무수행 ◎ 품종개량 지도 및 기록 작성, 수정증명서 발급 ◎ 생식기 질병에 감염된 가축 치료",다음 각 호의 어느 하나에 해당하는 자는 시·도지사의 면허를 받아 수정사가 될 수 있다.  1.「국가기술자격법」에 따른 기술자격 중 축산산업기사 이상의 자격을 취득한 자 2.시·도지사가 시행하는 수정사 시험에 합격한 자 ◎ 다음 결격사유에 해당하지 않은 자 1. 금치산자 또는 한정치산자,"2.「정신보건법」 제3조제1호에 따른 정신질환자. 다만, 정신건강의학과전문의가 수정사로서 업무를 수행할 수 있다고 인정하는 사람은 그러하지 아니하다. 3.「마약류관리에 관한 법률」 제40조에 따른 마약류중독자. 다만, 정신건강의학과전문의가 수정사로서 업무를 수행할 수 있다고 인정하는 사람은 그러하지 아니하다.",각 시도 축산과,"선택형 필기시험(과목별 20문항, 4지 택1형) 및 실기시험","◎ 필기 : 축산학개론, 축산법, 가축전염병예방법, 가축 번식학, 가축육종학 ◎ 실기 : 가축인공수정실기",매 과목 4할 이상 전 과목 총점 6할 이상,"◎축협중앙회, 시·도 축산직 공무원, 각 시·도 종축장 등에 근무하거나 대규모 농장의 품종개량 및 가축인공수정업무에 종사하고, 가축인공수정소를 개업할 수 있음. ◎직업의 특성상 가축에 대해 잘 알고 인공수정에 대한 지식이 요구되어 농장을 경영하는 자영업자가 자격을 취득하는 경우가 많음. 가축인공수정사 또는 수의사가 아니면 정액·난자 또는 수정란을 채취·처리하거나 이를 암 가축에 주입해서는 안 되도록 ‘축산법’에 규정되어 있음.  ◎‘70년대 말부터 축산정책에 따라 가축인공수정사 자격을 취득한 사람이 증가했지만 축산물 수입이 점차 증가하고 육류제품 가격인하의 영향으로 사육두수가 감소함에 따라 자격증에 대한 수요가 점차 감소하는 추세임. ◎국토의 70%가 산지라는 특수성과 육류나 우유의 소비가 나날이 늘어나고 있는데 비추어 축산업은 국가적 산업으로의 발전이 예상됨. 이러한 것으로 미루어 축산 관련학과 학생에게는 상당히 유리하고 전망이 밝은 직종이라 할 수 있음.",없음
농산물검사관,농산물품질관리법,농림축산식품부,http://www.mafra.go.kr/,"국립농산물품질관리원,국립종자원,지자체",http://www.naqs.go.kr ,농산물의 적절한 품질관리를 통하여 농산물의 안전성을 확보하고 상품성을 향상하며 공정하고 투명한 거래를 유도함으로써 농업인의 소득 증대와 소비자 보호에 이바지함을 목적으로 한다.,공정한 유통질서를 확립하고 소비자를 보호하기 위하여 정부가 수매하거나 수출 또는 수입하는 농산물 등에 대하여 검사하기 위함.,"곡류, 특작·서류, 과실·채소류, 종자류, 잠사류","정부가 수매하거나 수출 또는 수입하는 농산물이 기준에 맞는지를 검사하거나 농산물 검사 결과에 이의가 있을 시 즉시 재검사하여 결과를 통보하는 업무를 담당하고, 농산물 포장 또는 꼬리표에 검사날짜, 등급 등의 검사결과 표시, 검사받은 자에게 검사증명서 교부 등을 수행",◎다음 각 호의 어느 하나에 해당하는 사람으로서 국립농산물품질관리원장(누에씨 및 누에고치 농산물검사관의 경우에는 시·도지사를 말한다)이 실시하는 전형시험에 합격한 사람으로 한다.  1. 농산물 검사 관련 업무에 6개월 이상 종사한 공무원 2. 농산물 검사 관련 업무에 1년 이상 종사한 사람,◎농산물검사관의 자격이 취소된 사람은 자격이 취소된 날부터 1년이 지나지 아니하면 제1항에 따른 전형시험에 응시하거나 농산물검사관의 자격을 취득할 수 없다. ◎다음 각 호의 어느 하나에 해당하는 사람 1. 농산물 검사 관련 업무에 6개월 이상 종사한 공무원 2. 농산물 검사 관련 업무에 1년 이상 종사한 사람,"곡류, 특작·서류, 과실·채소류 - 국립농산물품질관리원(2012년부터 종자류 미시행) 종자류-국립종자원 잠사류-지자체 ","제1차 : 선택형 필기시험(진위형, 선택형) 제2차 : 실기시험","＊1차 필기시험 : 농산물의 검사에 관한 법규, 검사기준, 검사방법 등   ◎곡류 : 정곡, 조곡(농산물품질관리법 (고시, 예규 포함),검사규격 및 방법, 재배학원론 중 재배기술 분야 등)   ◎특작·서류 : 특작, 서류(농산물품질관리법 (고시, 예규 포함), 검사규격 및 방법, 재배학원론 중 재배환경 분야 등)   ◎과실·채소류 : 과실, 채소[농산물품질관리법(고시, 예규 포함), 검사규격 및 방법, 재배학원론 중 재배환경 분야 등]   ◎종자류 : 종자(종자산업법령 및 종자관리요강, 포장검사 및 종자검사실시요령, 종자생산이론 및 병해충분야 등)   ◎잠사(생사)류 : 잠사[농산물품질관리법(고시, 예규 포함) 및 검사규격, 생사류검사실시요령 등] ＊2차 실기시험 : 자격구분별로 해당 품목의 등급 및 품위 등에 대하여 실시    ◎곡류 : 정곡, 조곡(곡류검사규격 중 등급, 정립, 제현율, 도정도, 싸라기, 피해립, 수분 등 중요항목)   ◎특작·서류 : 특작, 서류(특작·서류 검사규격 중등급, 정립, 용적중, 중결점과, 경결점과 등 중요항목)   ◎과실·채소류 : 과실, 채소(과실·채소류검사규격 중 등급, 중결점과, 경결점과 등 중요항목)   ◎종자류 : 종자(품종, 발아율, 작물병해충명)   ◎잠사(생사)류 : 잠사(육안검사, 마디검사 등)",필기시험 및 실기시험 성적을 각각 100점 만점으로 하여 각각 60점 이상 ,공정한 유통질서 확립과 소비자 보호를 위해 정부가 수매하거나 수출 또는 수입하는 농산물 등에 대한 검사업무를 수행 ,없음
농산물품질관리사,농산물품질관리법,농림축산식품부,http://www.mafra.go.kr/,한국산업인력공단,http://www.q-net.or.kr/site/nongsanmul,농산물의 적절한 품질관리를 통하여 농산물의 안전성을 확보하고 상품성을 향상하며 공정하고 투명한 거래를 유도함으로써 농업인의 소득 증대와 소비자 보호에 이바지함을 목적으로 한다.,수많은 수입 농산물이 국내 농산물로 원산지를 둔갑시켜 농산물의 거래질서를 혼란시키고 있으며 소비자 피해가 늘어나는 등 농산물 원산지표시 위반 행위가 매년 급증함에 따라 소비자와 생산자의 피해를 최소화하며 원산지 표시의 신뢰성을 확보함으로써 농산물의 생산자 및 소비자를 보호하고 농산물의 유통질서를 확립하기 위하여 도입됨.,단일등급,"◎ 농산물품질관리사는 다음 각 호의 직무를 수행한다. 1.농산물의 등급 판정 2.농산물의 생산 및 수확 후 품질관리기술 지도 3.농산물의 출하 시기 조절, 품질관리기술에 관한 조언 4.그 밖에 농산물의 품질 향상과 유통 효율화에 필요한 업무로 농산물의 생산 및 수확 후의 품질관리기술(안전관리를 포함한다) 지도, 농산물의 선별·저장 및 포장시설 등의 운용·관리, 농산물의 선별·포장 및 브랜드개발 등 상품성향상 지도, 포장농산물의 표시사항 준수에 관한 지도, 농산물의 규격출하 지도, 농산물의 생산 및 수확 후의 품질관리기술(안전관리를 포함한다) 지도, 농산물의 선별·저장 및 포장시설 등의 운용·관리, 농산물의 선별·포장 및 브랜드개발 등 상품성향상 지도, 포장농산물의 표시사항 준수에 관한 지도, 농산물의 규격출하 지도",농림수산식품부장관이 실시하는 자격시험에 합격하여야 한다.,"◎학력, 성별, 나이 등에 제한을 두지 않음 ◎농산물품질관리사의 자격이 취소된 사람은 자격 취소일부터 2년이 지나지 아니하면 자격시험에 다시 응시할 수 없다. ◎자격시험과 관련하여 부정한 행위를 한 응시자에 대하여 해당 자격시험을 무효로 하고, 해당 자격시험의 시행일부터 2년간 자격시험의 응시자격을 정지한다.",한국산업인력공단,제1차 : 선택형 필기시험 제2차 : 실기시험,"◎필기시험 1.농수산물 품질관리 법령, 농수산물 유통 및 가격안정에 관한 법령, 농수산물의 원산지 표시에 관한 법령 2. 원예작물학 3. 농산물유통론 4. 수확 후의 품질관리론 ◎ 실기시험 1. 농산물 품질관리 실무 2. 농산물 등급판정 실무",1.필기 :각 과목 100점을 만점으로 하여 각 과목 40점 이상의 점수를 획득한 사람 중 평균점수가 60점 이상  2.실기 : 100점을 만점으로 하여 60점 이상,"WTO 가입으로 수입 농산물이 수없이 국내시장에 들어오면서 국내산 농산물로 둔갑되고 있는 현실임. 정부가 농산물의 출하 및 유통과정을 보다 엄격히 관리하여 안전하고 품질 좋은 농산물이 소비자에게 공급될 수 있도록 하기 위하여 농산물품질관리사 자격제도를 도입하게 되었으며 '정부가 농산물 품질관리사를 고용하는 산지, 소비지, 유통시설의 사업자에게 필요한 자금의 일부를 정책적인 차원에서 지원할 수 있도록 법적 근거(법 제29조 7항)를 두고 있어 농산물품질관리사는 향후 농산물 관련 전문자격자로서의 그 역할과 전망이 밝다고 할 수 있음. ",없음
말조련사,말산업 육성법,농림축산식품부,http://www.mafra.go.kr/,한국마사회,http://www.horsepia.com,말산업의 육성과 지원에 관한 사항을 정함으로써 말산업의 발전 기반을 조성하고 경쟁력을 강화하여 농어촌의 경제 활성화와 국민의 삶의 질 향상에 이바지함을 목적으로 한다.,국내산 말의 질적 개량 및 생산육성 분야 전문 인력을 양성하기 위해 자격제도가 도입됨.,"1급, 2급, 3급","말의 용도별 조련, 말의 능력 향상 등 말 조련에 관한 업무(경마장에서 경주마를 조련하는 행위는 제외한다)를 수행",농림수산식품부장관이 실시하는 자격시험에 합격하여야 한다.,"◎ 자격시험 응시자격은 다음과 같다.  ◎ 만 18세 이상인 사람 ◎ 1급 자격시험 : 2급 자격 취득 후 해당 실무경력 5년 이상 ◎ 2급 자격시험 : 3급 자격 취득 후 해당 실무경력 3년 이상 ◎ 다음 결격사유에 해당하지 않은 자 1.금치산자 또는 한정치산자 2.정신질환자. 다만, 정신건강의학과전문의가 업무를 수행할 수 있다고 인정하는 사람은 예외로 한다. 3.마약·대마(大麻) 또는 향정신성의약품 등으로 인하여 말조련 등의 직무를 수행하기에 부적합하다고 인정하는 사람 4.제2항에 따라 자격이 취소된 사람으로서 자격 취소 일부터 3년이 지나지 아니한 사람",한국마사회(예정),제1차 필기시험과 제2차 실기시험으로 구분하여 시행,"◎필기 : 마술학(馬術學), 마학(馬學), 말 보건관리, 말 관련 상식 및 법규 ◎실기 : 마술, 마필관리 실무, 말 조련 및 관리실무","과목당 100점을 만점으로 하여 각 과목 40점 이상이고, 전 과목 평균 60점 이상","◎말조련사는 말 관리와 훈련을 총괄하는 말 산업 신종 핵심직업이다. 선진국의 경우 대회 우승 말의 경매가격이 수십억 원을 호가하는 경우도 자주 있어 지원자가 끊이지 않고 있다. 국내 승마산업도 최근 2∼3년 사이에 폭발적인 신장세를 보이고 있고, 승마장마다 2∼3명씩 필요할 것으로 예상돼 가장 유망한 말 산업 전문직 중 하나로 주목받고 있다. ◎주요(권장) 진출 분야 : 전문 육성조련업체(11개소), 민간 육성전문목장(5개소)  ◎진출 가능 분야 : 대형 생산목장, 기타 말 분야(교배·승마·유통·운송·레저산업) 등 ",없음
장제사,말산업 육성법,농림축산식품부,http://www.mafra.go.kr/,한국마사회,http://www.horsepia.com,말산업의 육성과 지원에 관한 사항을 정함으로써 말산업의 발전 기반을 조성하고 경쟁력을 강화하여 농어촌의 경제 활성화와 국민의 삶의 질 향상에 이바지함을 목적으로 한다.,"현재 장제가 필요한 말은 1만 2,000여 마리로 추산되는데, 전국의 장제사는 총 60여명에 불과해 수요를 따라 잡지 못하고 있어 전문 인력을 양성하기 위해 도입","1급, 2급, 3급","말발굽 깎기, 편자의 제작 등 장제(裝蹄) 업무를 수행",농림수산식품부장관이 실시하는 자격시험에 합격하여야 한다.,"◎ 자격시험 응시자격은 다음과 같다.  ◎ 만 18세 이상인 사람 ◎ 1급 자격시험 : 2급 자격 취득 후 해당 실무경력 5년 이상 ◎ 2급 자격시험 : 3급 자격 취득 후 해당 실무경력 3년 이상 ◎ 다음 결격사유에 해당하지 않은 자 1.금치산자 또는 한정치산자 2.정신질환자. 다만, 정신건강의학과전문의가 업무를 수행할 수 있다고 인정하는 사람은 예외로 한다. 3.마약·대마(大麻) 또는 향정신성의약품 등으로 인하여 말조련 등의 직무를 수행하기에 부적합하다고 인정하는 사람 4.제2항에 따라 자격이 취소된 사람으로서 자격 취소 일부터 3년이 지나지 아니한 사람",한국마사회(예정),제1차 필기시험과 제2차 실기시험으로 구분하여 시행,"필기 : 장제학(裝蹄學)의 장제이론, 말의 해부 및 생리,  말 관련 상식 및 법규 실기 : 장제 실무","과목당 100점을 만점으로 하여 각 과목 40점 이상이고, 전 과목 평균 60점 이상","말 산업의 발전은 곧 말 수요의 확산과 함께 말 전문 수의사, 장제사, 경마기수, 재활승마지도사 등 말 관련 직종의 발전도 동반할 것으로 보인다. 특히 1급 장제사는 의사나 변호사 못지않은 수입을 자랑하며, 프리랜서나 사업체를 운영하는 사람도 많다. 또한 어린 경주마는 뼈가 연해 무리한 운동, 나쁜 자세, 기승자의 잘못된 훈련 등으로 발굽 기형이 오거나 발굽이 비정상적으로 약해질 수 있다. 이런 경우 장제사가 특수편자를 이용해 치료하기도 한다.",없음
산림기술자,산림자원의 조성 및 관리에 관한 법률,산림청,http://www.forest.go.kr/,산림청,http://www.forest.go.kr/,"산림자원의 조성과 관리를 통하여 산림의 다양한 기능을 발휘하게 하고 산림의 지속가능한 보전(保全)과 이용을 도모함으로써 국토의 보전, 국가경제의 발전 및 국민의 삶의 질 향상에 이바지함을 목적으로 한다.","산림의 효율적인 경영, 산림사업의 질적 수준 향상, 목재 구조물(構造物)의 안전성 도모, 그 밖의 산림사업에 관한 기술의 발전을 촉진하기 위하여 산림기술자 제도를 운영","산림경영기술자(기술특급, 기술1급, 기술2급, 기능특급, 기능1급, 기능2급), 산림공학기술자(특급, 1급, 2급), 목구조기술자(목구조시공, 목구조관리), 수목보호기술자","◎ 산림기술자는 다음 각 호의 업무를 수행한다. 1.산림경영계획서 작성 2.산림사업의 설계 및 감리 3.임도의 시공 및 관리 4.목재 구조물의 설치 및 관리 5.「산지관리법」에 따른 산지전용(山地轉用) 및 토석채취에 따른 복구사업 6.「산림문화·휴양에 관한 법률」에 따른 자연휴양림 조성 및 관리 7.「사방사업법」에 따른 사방사업(砂防事業)  ◎ 산림경영기술자(기술특급, 기술1급, 기술2급) 1.조림, 숲 가꾸기 또는 산림병해충방제 사업과 관련된 설계ㆍ시공 및 감리 2.가로수 등 수목의 전정사업 3.산림경영계획의 수립 4. 도시림 등의 조성ㆍ관리 사업에 대한 설계ㆍ시공 및 감리 5. 산림욕장의 조성ㆍ관리 사업에 대한 설계ㆍ시공 및 감리 6. 산림조사 및 선목  ◎ 산림경영기술자(기능특급, 기능1급, 기능2급) 1. 조림, 숲 가꾸기 또는 산림병해충 방제사업의 시공 2. 도시림 등의 조성ㆍ관리 사업 관련 시공 3. 산림욕장의 조성ㆍ관리 시공 ◎ 산림공학기술자(특급, 1급): 임도사업, 산불예방ㆍ진화시설 설치사업, 사방사업, 산지전용, 토석채취에 따른 복구사업, 휴양림ㆍ산촌생태마을ㆍ등산로 조성사업에 대한 계획ㆍ설계ㆍ시공, 시공지도 및 감리업무  ◎  산림공학기술자(2급) 1.건당 공사비 규모가 5억 원 미만인 다음 각 목 사업의 설계ㆍ시공 및 시공지도 가. 임도사업 나. 산불예방ㆍ진화시설 설치사업 다. 산지전용ㆍ채석ㆍ토사 채취에 따른 복구사업  라. 휴양림조성사업ㆍ산촌생태마을조성사업 2.건당 공사비 규모가 2억 원 미만인 사방사업의 설계ㆍ시공 및 시공지도  ◎ 목구조기술자(목구조시공): 목조주택 및 목조건축물 등 목구조물의 시공업무 ◎ 목구조기술자(목구조관리): 목조주택 및 목조건축물 등 목구조물의 시공관리 및 감독 업무 ◎ 수목보호기술자 : 수목피해 진단ㆍ처방 및 치유(방제를 포함한다)사업",각 종류 및 등급에 따라 관련 기술자격을 취득하거나 교육과정 이수 또는 관련 경력을 가진 자가 관할 시도지사에게 자격 신청 시 발급함.,"◎ 각 기술종류 및 등급에 따른 자격요건은 아래와 같다. (종류/등급(자격요건)) (1) 산림경영기술자/기술특급(「국가기술자격법」에 따른 산림기술사의 자격을 가진 자),기술1급(「국가기술자격법」에 따른 산림기사의 자격을 가진 자),기술2급(「국가기술자격법」에 따른 산림산업기사의 자격을 가진 자),기능특급(「국가기술자격법」에 따른 산림기능장의 자격을 가진 자),기능1급(「국가기술자격법」에 따른 산림기능사의 자격을 가진 자),기능2급(산림인력개발기관에서6주 이상의 교육을 이수한 자) (2) 산림공학기술자/특급(「국가기술자격법」에 따른 산림기술사의 자격을 가진 자로서 산림인력개발기관에서2주 이상의 산림공학과정 교육을 이수한 자. 다만, 산림공학기술자1급 또는2급의 자격을 가진 자가 「국가기술자격법」에 따른 산림기술사 자격을 취득한 경우에는 산림공학과정 교육을 이수한 것으로 본다.),1급(1.「국가기술자격법」에 따른 산림기사의 자격을 가진 자로서 산림인력개발기관에서2주 이상의 산림공학과정 교육을 이수한 자. 다만, 산림공학기술자2급 자격을 가진 자가 「국가기술자격법」에 따른 산림기사 이상의 자격을 취득한 경우에는 산림공학과정 교육을 이수한 것으로 본다. 2.「국가기술자격법」에 따른 토목기사 이상의 자격을 가진 자로서 산림공학기술 분야에5년 이상 종사하고 산림인력개발기관에서2주 이상의 산림공학과정 교육을 이수한 자. 다만, 산림공학기술자2급 자격을 가진 자가 「국가기술자격법」에 따른 토목기사 이상의 자격을 취득한 경우에는 산림공학과정 교육을 이수한 것으로 본다.),2급(1.「국가기술자격법」에 따른 산림산업기사의 자격을 가진 자로서 산림인력개발기관에서2주 이상의 산림공학과정 교육을 이수한 자 2.「국가기술자격법」에 따른 토목산업기사의 자격을 가진 자로서 산림공학기술 분야에5년 이상 종사하고 산림인력개발기관에서2주 이상의 산림공학과정 교육을 이수한 자) (3) 목구조기술자/목구조시공(산림인력개발기관(산림청 소속 산림교육원과 산림조합중앙회 소속 교육훈련기관)에서160시간 이상의 목구조시공과정 교육을 이수한 자), 목구조관리(1.목구조시공기술자로서1년 이상 건축목재시공 분야에 종사하고 산림인력개발기관에서120시간 이상의 목구조관리과정 교육을 이수한 자 2.「국가기술자격법」에 따른 건축목공기능사 또는 목재가공기능사 이상의 자격을 가진 자로서 산림인력개발기관에서120시간 이상의 목구조관리과정 교육을 이수한 자) (4) 수목보호기술자/수목보호기술자(「자격기본법」에 따른 국가공인을 받은 수목보호 관련 민간자격을 취득하고 「자격기본법」 제17조제2항에 따라 등록한 자)",시도지사가 발급주체,무시험 자격검정,없음,해당 자격기준에 따른 요건 충족 시 자격증 발급됨.,"앞으로 산림에 대한 수요가 증대되고 산지농업, 사냥, 산림휴양 등에 종합적인 산림 경영기법이 도입될 것으로 예상되며, 임도시설의 확충되고 육림, 벌체 등의 기계화가 촉진됨에 따라 기술자의 수요가 증가될 것으로 보인다.",없음
